Identifiant,Type,Description
E21.036T/B1D/FEUX,CAC-FEUX,Feux de signalisation Bretelle1 + Potence du E21.036T
E21.036T/B1D/R22P,CAC-R22P,Caisson tricolore (R22) du feux Droit Bretelle1 du E21.036T
E21.036T/B1D/R22R,CAC-R22R,Répétiteur (R22) du feux Droit Bretelle1 du E21.036T
E21.036T/B1D1/A17B14,CAC-A17B14,Présignalisation (A17/B14) Droit Bretelle1 du E21.036T
E21.036T/B1H/R22P,CAC-R22P,Caisson tricolore (R22) du feux Haut Bretelle1 du E21.036T
E21.036T/B2D1/A17B14,CAC-A17B14,Présignalisation (A17/B14) Droit Bretelle2 du E21.036T
